
Current register/bus values :
-------------------------------------
Instruction Count : 1
PC                : 0x00400004
Registers:
R0: 0x00000000
R1: 0x00000000
R2: 0x00000000
R3: 0x00000000
R4: 0x00000002
R5: 0x00000000
R6: 0x00000000
R7: 0x00000000
R8: 0x00000000
R9: 0x00000000
R10: 0x00000000
R11: 0x00000000
R12: 0x00000000
R13: 0x00000000
R14: 0x00000000
R15: 0x00000000
R16: 0x00000000
R17: 0x00000000
R18: 0x00000000
R19: 0x00000000
R20: 0x00000000
R21: 0x00000000
R22: 0x00000000
R23: 0x00000000
R24: 0x00000000
R25: 0x00000000
R26: 0x00000000
R27: 0x00000000
R28: 0x00000000
R29: 0x00000000
R30: 0x00000000
R31: 0x00000000
HI: 0x00000000
LO: 0x00000000


Current register/bus values :
-------------------------------------
Instruction Count : 2
PC                : 0x00400008
Registers:
R0: 0x00000000
R1: 0x00000000
R2: 0x00000000
R3: 0x00000000
R4: 0x00000002
R5: 0x00000003
R6: 0x00000000
R7: 0x00000000
R8: 0x00000000
R9: 0x00000000
R10: 0x00000000
R11: 0x00000000
R12: 0x00000000
R13: 0x00000000
R14: 0x00000000
R15: 0x00000000
R16: 0x00000000
R17: 0x00000000
R18: 0x00000000
R19: 0x00000000
R20: 0x00000000
R21: 0x00000000
R22: 0x00000000
R23: 0x00000000
R24: 0x00000000
R25: 0x00000000
R26: 0x00000000
R27: 0x00000000
R28: 0x00000000
R29: 0x00000000
R30: 0x00000000
R31: 0x00000000
HI: 0x00000000
LO: 0x00000000


Current register/bus values :
-------------------------------------
Instruction Count : 3
PC                : 0x0040000c
Registers:
R0: 0x00000000
R1: 0x00000000
R2: 0x00000000
R3: 0x00000000
R4: 0x00000002
R5: 0x00000003
R6: 0xffffffff
R7: 0x00000000
R8: 0x00000000
R9: 0x00000000
R10: 0x00000000
R11: 0x00000000
R12: 0x00000000
R13: 0x00000000
R14: 0x00000000
R15: 0x00000000
R16: 0x00000000
R17: 0x00000000
R18: 0x00000000
R19: 0x00000000
R20: 0x00000000
R21: 0x00000000
R22: 0x00000000
R23: 0x00000000
R24: 0x00000000
R25: 0x00000000
R26: 0x00000000
R27: 0x00000000
R28: 0x00000000
R29: 0x00000000
R30: 0x00000000
R31: 0x00000000
HI: 0x00000000
LO: 0x00000000


Current register/bus values :
-------------------------------------
Instruction Count : 4
PC                : 0x00400010
Registers:
R0: 0x00000000
R1: 0x00000000
R2: 0x00000000
R3: 0x00000000
R4: 0x00000002
R5: 0x00000003
R6: 0xffffffff
R7: 0x00000000
R8: 0x00000000
R9: 0x00000000
R10: 0x00000000
R11: 0x00000000
R12: 0x00000000
R13: 0x00000000
R14: 0x00000000
R15: 0x00000000
R16: 0x00000000
R17: 0x00000000
R18: 0x00000000
R19: 0x00000000
R20: 0x00000000
R21: 0x00000000
R22: 0x00000000
R23: 0x00000000
R24: 0x00000000
R25: 0x00000000
R26: 0x00000000
R27: 0x00000000
R28: 0x00000000
R29: 0x00000000
R30: 0x00000000
R31: 0x00000000
HI: 0x00000002
LO: 0x00000000


Current register/bus values :
-------------------------------------
Instruction Count : 5
PC                : 0x00400014
Registers:
R0: 0x00000000
R1: 0x00000000
R2: 0x00000000
R3: 0x00000000
R4: 0x00000002
R5: 0x00000003
R6: 0xffffffff
R7: 0x00000000
R8: 0x00000000
R9: 0x00000000
R10: 0x00000000
R11: 0x00000000
R12: 0x00000000
R13: 0x00000000
R14: 0x00000000
R15: 0x00000000
R16: 0x00000000
R17: 0x00000000
R18: 0x00000000
R19: 0x00000000
R20: 0x00000000
R21: 0x00000000
R22: 0x00000000
R23: 0x00000000
R24: 0x00000000
R25: 0x00000000
R26: 0x00000000
R27: 0x00000000
R28: 0x00000000
R29: 0x00000000
R30: 0x00000000
R31: 0x00000000
HI: 0x00000002
LO: 0x00000003


Current register/bus values :
-------------------------------------
Instruction Count : 6
PC                : 0x00400018
Registers:
R0: 0x00000000
R1: 0x00000000
R2: 0x00000000
R3: 0x00000000
R4: 0x00000002
R5: 0x00000003
R6: 0xffffffff
R7: 0x00000000
R8: 0x00000000
R9: 0x00000000
R10: 0x00000000
R11: 0x00000000
R12: 0x00000000
R13: 0x00000000
R14: 0x00000000
R15: 0x00000000
R16: 0x00000000
R17: 0x00000000
R18: 0x00000000
R19: 0x00000000
R20: 0x00000000
R21: 0x00000000
R22: 0x00000000
R23: 0x00000000
R24: 0x00000000
R25: 0x00000000
R26: 0x00000000
R27: 0x00000000
R28: 0x00000000
R29: 0x00000000
R30: 0x00000000
R31: 0x00000000
HI: 0x00000000
LO: 0x00000006


Current register/bus values :
-------------------------------------
Instruction Count : 7
PC       