
Current register/bus values :
-------------------------------------
Instruction Count : 10
PC                : 0x0040002c
Registers:
R0: 0x00000000
R1: 0x00000000
R2: 0x0000000a
R3: 0x00000001
R4: 0xffffffff
R5: 0x00401263
R6: 0x00000000
R7: 0x00000000
R8: 0x00000000
R9: 0x00000000
R10: 0x00000000
R11: 0x00000000
R12: 0x00000000
R13: 0x00000000
R14: 0x00000000
R15: 0x00000000
R16: 0x00000000
R17: 0x00000000
R18: 0x00000001
R19: 0x00000000
R20: 0x00000000
R21: 0x00000000
R22: 0x00000000
R23: 0x00000000
R24: 0x00000000
R25: 0x00000000
R26: 0x00000000
R27: 0x00000000
R28: 0x00000000
R29: 0x00000000
R30: 0x00000000
R31: 0x00400028
HI: 0x00000000
LO: 0x00000000


Current register/bus values :
-------------------------------------
Instruction Count : 11
PC                : 0x00400030
Registers:
R0: 0x00000000
R1: 0x00000000
R2: 0x0000000a
R3: 0x00000001
R4: 0xffffffff
R5: 0x00401263
R6: 0x00000000
R7: 0x00000000
R8: 0x00000000
R9: 0x00000000
R10: 0x00000000
R11: 0x00000000
R12: 0x00000000
R13: 0x00000000
R14: 0x00000000
R15: 0x00000000
R16: 0x00000000
R17: 0x00000000
R18: 0x00000001
R19: 0x00000002
R20: 0x00000000
R21: 0x00000000
R22: 0x00000000
R23: 0x00000000
R24: 0x00000000
R25: 0x00000000
R26: 0x00000000
R27: 0x00000000
R28: 0x00000000
R29: 0x00000000
R30: 0x00000000
R31: 0x00400028
HI: 0x00000000
LO: 0x00000000


Current register/bus values :
-------------------------------------
Instruction Count : 12
PC                : 0x00400034
Registers:
R0: 0x00000000
R1: 0x00000000
R2: 0x0000000a
R3: 0x00000001
R4: 0xffffffff
R5: 0x0040126c
R6: 0x00000000
R7: 0x00000000
R8: 0x00000000
R9: 0x00000000
R10: 0x00000000
R11: 0x00000000
R12: 0x00000000
R13: 0x00000000
R14: 0x00000000
R15: 0x00000000
R16: 0x00000000
R17: 0x00000000
R18: 0x00000001
R19: 0x00000002
R20: 0x00000000
R21: 0x00000000
R22: 0x00000000
R23: 0x00000000
R24: 0x00000000
R25: 0x00000000
R26: 0x00000000
R27: 0x00000000
R28: 0x00000000
R29: 0x00000000
R30: 0x00000000
R31: 0x00400028
HI: 0x00000000
LO: 0x00000000


Current register/bus values :
-------------------------------------
Instruction Count : 14
PC                : 0x00400048
Registers:
R0: 0x00000000
R1: 0x00000000
R2: 0x0000000a
R3: 0x00000001
R4: 0xffffffff
R5: 0x0040126c
R6: 0x00000000
R7: 0x00000000
R8: 0x00000000
R9: 0x00000000
R10: 0x00000000
R11: 0x00000000
R12: 0x00000000
R13: 0x00000000
R14: 0x00000000
R15: 0x00000000
R16: 0x00000000
R17: 0x00000000
R18: 0x00000001
R19: 0x00000002
R20: 0x00000000
R21: 0x00000004
R22: 0x00000000
R23: 0x00000000
R24: 0x00000000
R25: 0x00000000
R26: 0x00000000
R27: 0x00000000
R28: 0x00000000
R29: 0x00000000
R30: 0x00000000
R31: 0x00400028
HI: 0x00000000
LO: 0x00000000


Current register/bus values :
-------------------------------------
Instruction Count : 17
PC                : 0x00400054
Registers:
R0: 0x00000000
R1: 0x00000000
R2: 0x0000000a
R3: 0x00000001
R4: 0xffffffff
R5: 0x00401277
R6: 0x00000000
R7: 0x00000000
R8: 0x00000000
R9: 0x00000000
R10: 0x00000000
R11: 0x00000000
R12: 0x00000000
R13: 0x00000000
R14: 0x00000000
R15: 0x00000000
R16: 0x00000000
R17: 0x00000000
R18: 0x00000001
R19: 0x00000002
R20: 0x00000000
R21: 0x00000004
R22: 0x00000005
R23: 0x00000000
R24: 0x00000000
R25: 0x00000000
R26: 0x00000000
R27: 0x00000000
R28: 0x00000000
R29: 0x00000000
R30: 0x00000000
R31: 0x00400028
HI: 0x00000000
LO: 0x00000000


Current register/bus values :
-------------------------------------
Instruction Count : 20
PC                : 0x0040003c
Registers:
R0: 0x00000000
R1: 0x00000000
R2: 0x0000000a
R3: 0x00000001
R4: 0xffffffff
R5: 0x004012da
R6: 0x00000000
R7: 0x00000000
R8: 0x00000000
R9: 0x00000000
R10: 0x00000000
R11: 0x00000000
R12: 0x00000000
R13: 0x00000000
R14: 0x00000000
R15: 0x00000000
R16: 0x00000000
R17: 0x00000000
R18: 0x00000001
R19: 0x00000002
R20: 0x00000003
R21: 0x00000004
R22: 0x00000005
R23: 0x00000000
R24: 0x00000000
R25: 0x00000000
R26: 0x00000000
R27: 0x00000000
R28: 0x00000000
R29: 0x00000000
R30: 0x00000000
R31: 0x00400028
HI: 0x00000000
LO: 0x00000000


Current register/bus values :
-------------------------------------
Instruction Count : 23
PC                : 0x0004001c
Registers:
R0: 0x00000000
R1: 0x00000000
R2: 0x0000000a
R3: 0x00000001
R4: 0xffffffff
R5: 0x004012df
R6: 0x00000000
R7: 0x00000000
R8: 0x00000000
R9: 0x00000000
R10: 0x00000000
R11: 0x00000000
R12: 0x00000000
R13: 0x00000000
R14: 0x00000000
R15: 0x00000000
R16: 0x00000000
R17: 0x00000000
R18: 0x00000001
R19: 0x00000002
R20: 0x00000003
R21: 0x00000004
R22: 0x00000005
R23: 0x00000000
R24: 0x00000000
R25: 0x00000000
R26: 0x00000000
R27: 0x00000000
R28: 0x00000000
R29: 0x00000000
R30: 0x00000000
R31: 0x00400028
HI: 0x00000000
LO: 0x00000000


Current register/bus values :
-------------------------------------
Instruction Count : 24
PC                : 0x00040020
Registers:
R0: 0x00000000
R1: 0x00000000
R2: 0x0000000a
R3: 0x00000001
R4: 0xffffffff
R5: 0x004012df
R6: 0x00000000
R7: 0x00000000
R8: 0x00000000
R9: 0x00000000
R10: 0x00000000
R11: 0x00000000
R12: 0x00000000
R13: 0x00000000
R14: 0x00000000
R15: 0x00000000
R16: 0x00000000
R17: 0x00000000
R18: 0x00000001
R19: 0x00000002
R20: 0x00000003
R21: 0x00000004
R22: 0x00000005
R23: 0x00000000
R24: 0x00000000
R25: 0x00000000
R26: 0x00000000
R27: 0x00000000
R28: 0x00000000
R29: 0x00000000
R30: 0x00000000
R31: 0x00400028
HI: 0x00000000
LO: 0x00000000


Current register/bus values :
-------------------------------------
Instruction Count : 25
PC                : 0x00040024
Registers:
R0: 0x00000000
R1: 0x00000000
R2: 0x0000000a
R3: 0x00000001
R4: 0xffffffff
R5: 0x004012df
R6: 0x00000000
R7: 0x00000000
R8: 0x00000000
R9: 0x00000000
R10: 0x00000000
R11: 0x00000000
R12: 0x00000000
R13: 0x00000000
R14: 0x00000000
R15: 0x00000000
R16: 0x00000000
R17: 0x00000000
R18: 0x00000001
R19: 0x00000002
R20: 0x00000003
R21: 0x00000004
R22: 0x00000005
R23: 0x00000000
R24: 0x00000000
R25: 0x00000000
R26: 0x00000000
R27: 0x00000000
R28: 0x00000000
R29: 0x00000000
R30: 0x00000000
R31: 0x00400028
HI: 0x00000000
LO: 0x00000000


Current register/bus values :
-------------------------------------
Instruction Count : 26
PC                : 0x00040028
Registers:
R0: 0x00000000
R1: 0x00000000
R2: 0x0000000a
R3: 0x00000001
R4: 0xffffffff
R5: 0x004012df
R6: 0x00000000
R7: 0x00000000
R8: 0x00000000
R9: 0x00000000
R10: 0x00000000
R11: 0x00000000
R12: 0x00000000
R13: 0x00000000
R14: 0x00000000
R15: 0x00000000
R16: 0x00000000
R17: 0x00000000
R18: 0x00000001
R19: 0x00000002
R20: 0x00000003
R21: 0x00000004
R22: 0x00000005
R23: 0x00000000
R24: 0x00000000
R25: 0x00000000
R26: 0x00000000
R27: 0x00000000
R28: 0x00000000
R29: 0x00000000
R30: 0x00000000
R31: 0x00400028
HI: 0x00000000
LO: 0x00000000


Current register/bus values :
-------------------------------------
Instruction Count : 27
PC                : 0x0004002c
Registers:
R0: 0x00000000
R1: 0x00000000
R2: 0x0000000a
R3: 0x00000001
R4: 0xffffffff
R5: 0x004012df
R6: 0x00000000
R7: 0x00000000
R8: 0x00000000
R9: 0x00000000
R10: 0x00000000
R11: 0x00000000
R12: 0x00000000
R13: 0x00000000
R14: 0x00000000
R15: 0x00000000
R16: 0x00000000
R17: 0x00000000
R18: 0x00000001
R19: 0x00000002
R20: 0x00000003
R21: 0x00000004
R22: 0x00000005
R23: 0x00000000
R24: 0x00000000
R25: 0x00000000
R26: 0x00000000
R27: 0x00000000
R28: 0x00000000
R29: 0x00000000
R30: 0x00000000
R31: 0x00400028
HI: 0x00000000
LO: 0x00000000


Current register/bus values :
-------------------------------------
Instruction Count : 28
PC                : 0x00040030
Registers:
R0: 0x00000000
R1: 0x00000000
R2: 0x0000000a
R3: 0x00000001
R4: 0xffffffff
R5: 0x004012df
R6: 0x00000000
R7: 0x00000000
R8: 0x00000000
R9: 0x00000000
R10: 0x00000000
R11: 0x00000000
R12: 0x00000000
R13: 0x00000000
R14: 0x00000000
R15: 0x00000000
R16: 0x00000000
R17: 0x00000000
R18: 0x00000001
R19: 0x00000002
R20: 0x00000003
R21: 0x00000004
R22: 0x00000005
R23: 0x00000000
R24: 0x00000000
R25: 0x00000000
R26: 0x00000000
R27: 0x00000000
R28: 0x00000000
R29: 0x00000000
R30: 0x00000000
R31: 0x00400028
HI: 0x00000000
LO: 0x00000000


Current register/bus values :
-------------------------------------
Instruction Count : 29
PC                : 0x00040034
Registers:
R0: 0x00000000
R1: 0x00000000
R2: 0x0000000a
R3: 0x000